<?xml version="1.0" encoding="utf-8" ?>
<configuration xmlns:xsi="http://www.w3.org/2001/XMLSchema-instance" xsi:noNamespaceSchemaLocation="../../SDL.Client.Core/configuration.xsd">

	<resourceGroups>
		<resourceGroup name="SDL.UI.Views.Resources">
			<files>
				<file name="resources.default.resjson"/>
				<file name="resources.{CULTURE}.resjson"/>
			</files>
			<dependencies>
				<dependency name="SDL.Client.Libraries.SDL.Globalize"/>
			</dependencies>
		</resourceGroup>
	</resourceGroups>

</configuration>