<?xml version="1.0" encoding="utf-8" ?>
<configuration xmlns:xsi="http://www.w3.org/2001/XMLSchema-instance" xsi:noNamespaceSchemaLocation="../../SDL.Client.Core/configuration.xsd">
	<resourceGroups>
		
		<resourceGroup name="SDL.UI.Core.Renderers">
			<dependencies>
				<dependency name="SDL.UI.Core.Renderers.ControlRenderer"/>
				<dependency name="SDL.UI.Core.Renderers.ViewRenderer"/>
			</dependencies>
		</resourceGroup>
		
		<resourceGroup name="SDL.UI.Core.Renderers.ControlRenderer">
			<files>
				<file name="ControlRenderer.js"/>
			</files>
			<dependencies>
				<dependency name="SDL.Client.Diagnostics"/>
				<dependency name="SDL.Client.Types.Base"/>
				<dependency name="SDL.Client.Types.Array"/>
			</dependencies>
		</resourceGroup>
		
		<resourceGroup name="SDL.UI.Core.Renderers.ViewRenderer">
			<files>
				<file name="ViewRenderer.js"/>
			</files>
			<dependencies>
				<dependency name="SDL.Client.Diagnostics"/>
				<dependency name="SDL.Client.Types.Base"/>
				<dependency name="SDL.Client.Types.Array"/>
			</dependencies>
		</resourceGroup>

	</resourceGroups>

</configuration>