<?xml version="1.0" encoding="utf-8" ?>
<configuration xmlns:xsi="http://www.w3.org/2001/XMLSchema-instance" xsi:noNamespaceSchemaLocation="../../configuration.xsd">

	<resourceGroups>
		<resourceGroup name="SDL.Client.Models.MessageCenter">
			<files>
				<file name="MessageCenter.js"/>
				<file name="Message.js"/>
				<file name="NotificationMessage.js"/>
				<file name="WarningMessage.js"/>
				<file name="ErrorMessage.js"/>
				<file name="QuestionMessage.js"/>
				<file name="GoalMessage.js"/>
				<file name="ProgressMessage.js"/>
			</files>
			<dependencies>
				<dependency name="SDL.Client.Models"/>
				<dependency name="SDL.Client.MessageCenter"/>
			</dependencies>
		</resourceGroup>
	</resourceGroups>

</configuration>