<?xml version="1.0" encoding="utf-8" ?>
<configuration xmlns:xsi="http://www.w3.org/2001/XMLSchema-instance"
			   xsi:noNamespaceSchemaLocation="..\..\..\..\..\SDL.Client\SDL.Client.Core\configuration.xsd">

	<resourceGroups>
		<resourceGroup name="SDL.Client.UI.ApplicationHost.Views.Frame">
			<files>
				<file name="Frame.js"/>
				<file name="styles/Frame.css"/>
				<file name="cultures/frame.js"/>
				<file name="cultures/frame.{CULTURE}.js"/>
				<file name="Frame.htm"/>
			</files>
			<dependencies>
				<dependency name="SDL.Client.UI.ApplicationHost.ViewModels"/>
				<dependency name="SDL.UI.Core.Views.ViewBase"/>
				<dependency name="SDL.UI.Core.Knockout.Renderers"/>
				<dependency name="SDL.UI.Core.Knockout.BindingHandlers"/>
				<dependency name="SDL.Client.Libraries.SDL.Globalize"/>
				<dependency name="SDL.UI.Controls.Knockout.TopBar"/>
			</dependencies>
		</resourceGroup>

		<resourceGroup name="SDL.Client.UI.ApplicationHost.Views.Frame.Init">
			<dependencies>
				<dependency name="SDL.Client.UI.ApplicationHost.Views.Frame"/>
				<dependency name="SDL.UI.Core.Init"/>
			</dependencies>
		</resourceGroup>
		
	</resourceGroups>

</configuration>