<?xml version="1.0" encoding="utf-8" ?>
<configuration  xmlns:xsi="http://www.w3.org/2001/XMLSchema-instance" xsi:noNamespaceSchemaLocation="../../SDL.Client.Core/configuration.xsd">

    <resourceGroups>
        <resourceGroup name="SDL.UI.Controls.LibraryPanel">
            <files>
                <file name="Styles\sdl.carbon2.library-panel.css"/>
                <file name="SDL.UI.Controls.LibraryPanel.js"/>
                <file name="Resource\resources.js"/>
            </files>
            <dependencies>
                <dependency name="SDL.UI.Core.Controls.ControlBase"/>
                <dependency name="SDL.UI.Controls.ScrollView"/>
                <dependency name="SDL.UI.Controls.Button"/>
                <dependency name="SDL.Client.UI.Core.Libraries.Polyfills"/>
            </dependencies>
        </resourceGroup>

        <resourceGroup name="SDL.UI.Controls.JQuery.LibraryPanel">
            <files>
                <file name="SDL.UI.Controls.LibraryPanel.jQuery.js"/>
            </files>
            <dependencies>
                <dependency name="SDL.Client.Libraries.SDL.JQuery"/>
                <dependency name="SDL.UI.Core.Controls.JQuery"/>
                <dependency name="SDL.UI.Controls.LibraryPanel"/>
            </dependencies>
        </resourceGroup>
    </resourceGroups>

</configuration>