<?xml version="1.0" encoding="utf-8" ?>
<configuration xmlns:xsi="http://www.w3.org/2001/XMLSchema-instance" xsi:noNamespaceSchemaLocation="../../SDL.Client.Core/configuration.xsd">

	<resourceGroups>

		<resourceGroup name="SDL.UI.Core.Knockout.ViewModels">
			<files>
				<file name="ViewModelItem.js"/>
				<file name="ViewModel.js"/>
			</files>
			<dependencies>
				<dependency name="SDL.Client.Types.OO"/>
				<dependency name="SDL.Client.Models"/>
				<dependency name="SDL.UI.Core.Knockout.ViewModels.Base"/>
			</dependencies>
		</resourceGroup>

		<resourceGroup name="SDL.UI.Core.Knockout.ViewModels.Base">
			<files>
				<file name="ViewModelBase.js"/>
			</files>
			<dependencies>
				<dependency name="SDL.UI.Core.Knockout.Libraries.Knockout"/>
				<dependency name="SDL.Client.Libraries.SDL.Globalize"/>
			</dependencies>
		</resourceGroup>
	
	</resourceGroups>
</configuration>