<?xml version="1.0" encoding="utf-8" ?>
<configuration xmlns:xsi="http://www.w3.org/2001/XMLSchema-instance" xsi:noNamespaceSchemaLocation="../configuration.xsd">

	<include src="jQuery/_Config.xml"/>
	<include src="Globalize/_Config.xml"/>

	<!-- All Libraries -->
	<resourceGroups>
		<resourceGroup name="SDL.Client.Libraries">
			<dependencies>
				<dependency name="SDL.Client.Libraries.SDL.JQuery"/>
				<dependency name="SDL.Client.Libraries.SDL.Globalize"/>
			</dependencies>
		</resourceGroup>
	</resourceGroups>

</configuration>