<?xml version="1.0" encoding="utf-8" ?>
<configuration  xmlns:xsi="http://www.w3.org/2001/XMLSchema-instance" xsi:noNamespaceSchemaLocation="../../SDL.Client.Core/configuration.xsd">

	<resourceGroups>
		<resourceGroup name="SDL.UI.Controls.Button">
			<files>
				<file name="Button.js"/>
				<file name="Button.css"/>
			</files>
			<dependencies>
				<dependency name="SDL.UI.Core.Controls.ControlBase"/>
				<dependency name="SDL.UI.Core.Event.Constants"/>
			</dependencies>
		</resourceGroup>

		<resourceGroup name="SDL.UI.Controls.JQuery.Button">
			<files>
				<file name="Button.jQuery.js"/>
			</files>
			<dependencies>
				<dependency name="SDL.Client.Libraries.SDL.JQuery"/>
				<dependency name="SDL.UI.Core.Controls.JQuery"/>
				<dependency name="SDL.UI.Controls.Button"/>
			</dependencies>
		</resourceGroup>
	</resourceGroups>

</configuration>