<?xml version="1.0" encoding="utf-8"?>
<configuration xmlns:xsi="http://www.w3.org/2001/XMLSchema-instance"
               xsi:noNamespaceSchemaLocation="../../Common/Library/Core/configuration.xsd">
    <resourceGroups>

        <resourceGroup name="LVF.ViewModelItems.Store">
            <files>
                <file name="Store.js" />
            </files>
            <dependencies>
                <dependency name="SDL.UI.Core.Knockout.ViewModels" />
                <dependency name="SDL.UI.Core.Knockout.ViewModels.Base" />
            </dependencies>
        </resourceGroup>

        <resourceGroup name="LVF.ViewModelItems.ProductList">
            <files>
                <file name="ProductList.js"/>
            </files>
            <dependencies>
                <dependency name="SDL.UI.Core.Knockout.ViewModels"/>
                <dependency name="SDL.UI.Core.Knockout.ViewModels.Base"/>
            </dependencies>
        </resourceGroup>

        <resourceGroup name="LVF.ViewModelItems.Product">
            <files>
                <file name="Product.js"/>
            </files>
            <dependencies>
                <dependency name="SDL.UI.Core.Knockout.ViewModels"/>
                <dependency name="SDL.UI.Core.Knockout.ViewModels.Base"/>
            </dependencies>
        </resourceGroup>

        <resourceGroup name="LVF.ViewModelItems.CollectionList">
            <files>
                <file name="CollectionList.js"/>
            </files>
            <dependencies>
                <dependency name="SDL.UI.Core.Knockout.ViewModels"/>
                <dependency name="SDL.UI.Core.Knockout.ViewModels.Base"/>
            </dependencies>
        </resourceGroup>
    </resourceGroups>
</configuration>