<?xml version="1.0" encoding="utf-8" ?>
<configuration  xmlns:xsi="http://www.w3.org/2001/XMLSchema-instance" xsi:noNamespaceSchemaLocation="../../SDL.Client.Core/configuration.xsd">

	<resourceGroups>
		<resourceGroup name="SDL.UI.Controls.RadioButton">
			<files>
				<file name="RadioButton.js"/>
				<file name="RadioButton.css"/>
			</files>
			<dependencies>
				<dependency name="SDL.UI.Core.Controls.ControlBase"/>
			</dependencies>
		</resourceGroup>

		<resourceGroup name="SDL.UI.Controls.JQuery.RadioButton">
			<files>
				<file name="RadioButton.jQuery.js"/>
			</files>
			<dependencies>
				<dependency name="SDL.Client.Libraries.SDL.JQuery"/>
				<dependency name="SDL.UI.Core.Controls.JQuery"/>
				<dependency name="SDL.UI.Controls.RadioButton"/>
			</dependencies>
		</resourceGroup>
	</resourceGroups>

</configuration>