<?xml version="1.0" encoding="utf-8" ?>
<configuration xmlns:xsi="http://www.w3.org/2001/XMLSchema-instance" xsi:noNamespaceSchemaLocation="../../configuration.xsd">

	<resourceGroups>

		<resourceGroup name="SDL.Client.Libraries.SDL.Globalize">
			<files>
				<file name="SDL.Globalize.js"/>
				<file name="globalize.js"/>
				<file name="SDL.Globalize.init.js"/>
				<file name="cultures/globalize.culture.{CULTURE}.js"/>
			</files>
			<dependencies>
				<dependency name="SDL.Client.Libraries.SDL.JQuery"/>
				<dependency name="SDL.Client.Localization"/>
				<dependency name="SDL.Client.Types.Base"/>
				<dependency name="SDL.Client.Types.Date"/>
				<dependency name="SDL.Client.Event.EventRegister"/>
				<dependency name="SDL.Client.Resources.ResourceManager"/>
			</dependencies>
		</resourceGroup>
		
	</resourceGroups>

</configuration>