<?xml version="1.0" encoding="utf-8" ?>
<configuration  xmlns:xsi="http://www.w3.org/2001/XMLSchema-instance" xsi:noNamespaceSchemaLocation="../../SDL.Client.Core/configuration.xsd">

	<resourceGroups>
		<resourceGroup name="SDL.UI.Controls.Knockout.LineGraph">
			<files>
				<file name="LineGraph.css"/>
				<file name="app.js"/>
				<file name="LineGraphKo.js"/>
				<file name="LineGraph.js"/>
			</files>
			<dependencies>
				<dependency name="SDL.Client.Libraries.SDL.Globalize" />
				<dependency name="SDL.UI.Core.Knockout.Libraries.Knockout"/>
				<dependency name="SDL.UI.Libraries.D3"/>
			</dependencies>
		</resourceGroup>
	</resourceGroups>
</configuration>