<?xml version="1.0" encoding="utf-8" ?>
<configuration xmlns:xsi="http://www.w3.org/2001/XMLSchema-instance" xsi:noNamespaceSchemaLocation="../configuration.xsd">
	<resourceGroups>
		<resourceGroup name="SDL.Client.ApplicationHost">
			<files>
				<file name="ApplicationManifestReceiver.js"/>
				<file name="ApplicationHost.js"/>
				<file name="ApplicationHostFacade.js"/>
			</files>
			<dependencies>
				<dependency name="SDL.Client.Xml"/>
				<dependency name="SDL.Client.Types.Object"/>
				<dependency name="SDL.Client.Types.Array"/>
				<dependency name="SDL.Client.Types.Url"/>
				<dependency name="SDL.Client.Configuration.ConfigurationManager"/>
				<dependency name="SDL.Client.CrossDomainMessaging"/>
				<dependency name="SDL.Client.Resources.ResourceManager"/>
			</dependencies>
		</resourceGroup>
	</resourceGroups>
</configuration>