<?xml version="1.0" encoding="utf-8" ?>
<configuration  xmlns:xsi="http://www.w3.org/2001/XMLSchema-instance" xsi:noNamespaceSchemaLocation="../SDL.Client.Core/configuration.xsd">

	<packages>
		<package name="SDL.UI.Controls.Knockout">
			<resourceGroups>
				<resourceGroup name="SDL.UI.Controls.Knockout.ActionBar"/>
				<resourceGroup name="SDL.UI.Controls.Knockout.ActivityIndicator"/>
				<resourceGroup name="SDL.UI.Controls.Knockout.Button"/>
				<resourceGroup name="SDL.UI.Controls.Knockout.Callout"/>
				<resourceGroup name="SDL.UI.Controls.Knockout.Dialog"/>
				<resourceGroup name="SDL.UI.Controls.Knockout.Message"/>
				<resourceGroup name="SDL.UI.Controls.Knockout.ResizeTrigger"/>
				<resourceGroup name="SDL.UI.Controls.Knockout.TopBar"/>
				<resourceGroup name="SDL.UI.Controls.Knockout.TopPageTabs"/>
				<resourceGroup name="SDL.UI.Controls.Knockout.Tooltip"/>
				<resourceGroup name="SDL.UI.Controls.Knockout.ScrollView"/>
				<resourceGroup name="SDL.UI.Controls.Knockout.LineGraph"/>
				<resourceGroup name="SDL.UI.Controls.Knockout.TextInput"/>
                <resourceGroup name="SDL.UI.Controls.Knockout.DatePicker"/>
				<resourceGroup name="SDL.UI.Controls.Knockout.Checkbox"/>
				<resourceGroup name="SDL.UI.Controls.Knockout.RadioButton"/>
				<resourceGroup name="SDL.UI.Controls.Knockout.DropdownList"/>
				<resourceGroup name="SDL.UI.Controls.Knockout.Application.ViewModels.TopBar"/>
			</resourceGroups>
		</package>
	</packages>

</configuration>