<?xml version="1.0" encoding="utf-8"?>
<configuration xmlns:xsi="http://www.w3.org/2001/XMLSchema-instance"
               xsi:noNamespaceSchemaLocation="../../Common/Library/Core/configuration.xsd">
    <resourceGroups>

        <resourceGroup name="LVF.Controls.Navigation">
            <files>
                <file name="Navigation/Navigation.js"/>
            </files>
            <dependencies>
                <dependency name="SDL.UI.Core.Knockout.Controls"/>
            </dependencies>
        </resourceGroup>

        <resourceGroup name="LVF.Controls.Knockout.Navigation">
            <files>
                <file name="Knockout/Navigation.js"/>
            </files>
            <dependencies>
                <dependency name="LVF.Controls.Navigation"/>
            </dependencies>
        </resourceGroup>

    </resourceGroups>
</configuration>